{
  "concept": "va-sac-compliance",
  "counts": {
    "aligned": 148,
    "sac_says_avoid_but_portable": 23,
    "sac_says_use_but_not_portable": 0,
    "sac_silent_on_portable": 58,
    "sac_silent_on_unportable": 94
  },
  "description": "Cross-reference between VA Standards and Conventions and the pragmatic M standard. Filter to concern in [sac_says_use_but_not_portable, sac_says_avoid_but_portable] for portability gaps that VistA developers should review.",
  "entries": [
    {
      "concept": "commands",
      "concern": "sac_silent_on_unportable",
      "name": "ABLOCK",
      "notes": "",
      "pragmatic_tier": "ansi-unimplemented",
      "sac_section": "",
      "sac_status": ""
    },
    {
      "concept": "commands",
      "concern": "sac_silent_on_unportable",
      "name": "ASSIGN",
      "notes": "",
      "pragmatic_tier": "ansi-unimplemented",
      "sac_section": "",
      "sac_status": ""
    },
    {
      "concept": "commands",
      "concern": "sac_silent_on_unportable",
      "name": "ASTART",
      "notes": "",
      "pragmatic_tier": "ansi-unimplemented",
      "sac_section": "",
      "sac_status": ""
    },
    {
      "concept": "commands",
      "concern": "sac_silent_on_unportable",
      "name": "ASTOP",
      "notes": "",
      "pragmatic_tier": "ansi-unimplemented",
      "sac_section": "",
      "sac_status": ""
    },
    {
      "concept": "commands",
      "concern": "sac_silent_on_unportable",
      "name": "AUNBLOCK",
      "notes": "",
      "pragmatic_tier": "ansi-unimplemented",
      "sac_section": "",
      "sac_status": ""
    },
    {
      "concept": "commands",
      "concern": "sac_says_avoid_but_portable",
      "name": "BREAK",
      "notes": "Break command used.",
      "pragmatic_tier": "core",
      "sac_section": "XINDEX rule 25 (severity S)",
      "sac_status": "forbidden"
    },
    {
      "concept": "commands",
      "concern": "sac_silent_on_unportable",
      "name": "CATCH",
      "notes": "",
      "pragmatic_tier": "iris-only",
      "sac_section": "",
      "sac_status": ""
    },
    {
      "concept": "commands",
      "concern": "sac_silent_on_portable",
      "name": "CLOSE",
      "notes": "",
      "pragmatic_tier": "core",
      "sac_section": "",
      "sac_status": ""
    },
    {
      "concept": "commands",
      "concern": "sac_silent_on_unportable",
      "name": "CONTINUE",
      "notes": "",
      "pragmatic_tier": "iris-only",
      "sac_section": "",
      "sac_status": ""
    },
    {
      "concept": "commands",
      "concern": "sac_silent_on_portable",
      "name": "DO",
      "notes": "",
      "pragmatic_tier": "core",
      "sac_section": "",
      "sac_status": ""
    },
    {
      "concept": "commands",
      "concern": "sac_silent_on_portable",
      "name": "ELSE",
      "notes": "",
      "pragmatic_tier": "core",
      "sac_section": "",
      "sac_status": ""
    },
    {
      "concept": "commands",
      "concern": "sac_silent_on_unportable",
      "name": "ELSEIF",
      "notes": "",
      "pragmatic_tier": "iris-only",
      "sac_section": "",
      "sac_status": ""
    },
    {
      "concept": "commands",
      "concern": "sac_silent_on_unportable",
      "name": "ESTART",
      "notes": "",
      "pragmatic_tier": "ansi-unimplemented",
      "sac_section": "",
      "sac_status": ""
    },
    {
      "concept": "commands",
      "concern": "sac_silent_on_unportable",
      "name": "ESTOP",
      "notes": "",
      "pragmatic_tier": "ansi-unimplemented",
      "sac_section": "",
      "sac_status": ""
    },
    {
      "concept": "commands",
      "concern": "sac_silent_on_unportable",
      "name": "ETRIGGER",
      "notes": "",
      "pragmatic_tier": "ansi-unimplemented",
      "sac_section": "",
      "sac_status": ""
    },
    {
      "concept": "commands",
      "concern": "sac_silent_on_portable",
      "name": "FOR",
      "notes": "",
      "pragmatic_tier": "core",
      "sac_section": "",
      "sac_status": ""
    },
    {
      "concept": "commands",
      "concern": "sac_silent_on_portable",
      "name": "GOTO",
      "notes": "",
      "pragmatic_tier": "core",
      "sac_section": "",
      "sac_status": ""
    },
    {
      "concept": "commands",
      "concern": "sac_says_avoid_but_portable",
      "name": "HALT",
      "notes": "'HALT' command should be invoked through 'G ^XUSCLEAN'.",
      "pragmatic_tier": "core",
      "sac_section": "XINDEX rule 32 (severity S)",
      "sac_status": "restricted"
    },
    {
      "concept": "commands",
      "concern": "sac_silent_on_portable",
      "name": "HANG",
      "notes": "",
      "pragmatic_tier": "core",
      "sac_section": "",
      "sac_status": ""
    },
    {
      "concept": "commands",
      "concern": "sac_silent_on_portable",
      "name": "IF",
      "notes": "",
      "pragmatic_tier": "core",
      "sac_section": "",
      "sac_status": ""
    },
    {
      "concept": "commands",
      "concern": "sac_says_avoid_but_portable",
      "name": "JOB",
      "notes": "Should use 'TASKMAN' instead of 'JOB' command.",
      "pragmatic_tier": "core",
      "sac_section": "XINDEX rule 36 (severity S)",
      "sac_status": "restricted"
    },
    {
      "concept": "commands",
      "concern": "sac_silent_on_portable",
      "name": "KILL",
      "notes": "",
      "pragmatic_tier": "core",
      "sac_section": "",
      "sac_status": ""
    },
    {
      "concept": "commands",
      "concern": "sac_silent_on_unportable",
      "name": "KSUBSCRIPTS",
      "notes": "",
      "pragmatic_tier": "ansi-unimplemented",
      "sac_section": "",
      "sac_status": ""
    },
    {
      "concept": "commands",
      "concern": "sac_silent_on_unportable",
      "name": "KVALUE",
      "notes": "",
      "pragmatic_tier": "ansi-unimplemented",
      "sac_section": "",
      "sac_status": ""
    },
    {
      "concept": "commands",
      "concern": "sac_silent_on_portable",
      "name": "LOCK",
      "notes": "",
      "pragmatic_tier": "core",
      "sac_section": "",
      "sac_status": ""
    },
    {
      "concept": "commands",
      "concern": "sac_silent_on_portable",
      "name": "MERGE",
      "notes": "",
      "pragmatic_tier": "core",
      "sac_section": "",
      "sac_status": ""
    },
    {
      "concept": "commands",
      "concern": "sac_silent_on_portable",
      "name": "NEW",
      "notes": "",
      "pragmatic_tier": "core",
      "sac_section": "",
      "sac_status": ""
    },
    {
      "concept": "commands",
      "concern": "sac_silent_on_portable",
      "name": "OPEN",
      "notes": "",
      "pragmatic_tier": "core",
      "sac_section": "",
      "sac_status": ""
    },
    {
      "concept": "commands",
      "concern": "sac_silent_on_unportable",
      "name": "PRINT",
      "notes": "",
      "pragmatic_tier": "iris-only",
      "sac_section": "",
      "sac_status": ""
    },
    {
      "concept": "commands",
      "concern": "sac_silent_on_portable",
      "name": "QUIT",
      "notes": "",
      "pragmatic_tier": "core",
      "sac_section": "",
      "sac_status": ""
    },
    {
      "concept": "commands",
      "concern": "sac_silent_on_portable",
      "name": "READ",
      "notes": "",
      "pragmatic_tier": "core",
      "sac_section": "",
      "sac_status": ""
    },
    {
      "concept": "commands",
      "concern": "sac_silent_on_unportable",
      "name": "RETURN",
      "notes": "",
      "pragmatic_tier": "iris-only",
      "sac_section": "",
      "sac_status": ""
    },
    {
      "concept": "commands",
      "concern": "sac_silent_on_unportable",
      "name": "RLOAD",
      "notes": "",
      "pragmatic_tier": "ansi-unimplemented",
      "sac_section": "",
      "sac_status": ""
    },
    {
      "concept": "commands",
      "concern": "sac_silent_on_unportable",
      "name": "RSAVE",
      "notes": "",
      "pragmatic_tier": "ansi-unimplemented",
      "sac_section": "",
      "sac_status": ""
    },
    {
      "concept": "commands",
      "concern": "sac_silent_on_portable",
      "name": "SET",
      "notes": "",
      "pragmatic_tier": "core",
      "sac_section": "",
      "sac_status": ""
    },
    {
      "concept": "commands",
      "concern": "sac_silent_on_portable",
      "name": "TCOMMIT",
      "notes": "",
      "pragmatic_tier": "core",
      "sac_section": "",
      "sac_status": ""
    },
    {
      "concept": "commands",
      "concern": "sac_silent_on_unportable",
      "name": "THEN",
      "notes": "",
      "pragmatic_tier": "ansi-unimplemented",
      "sac_section": "",
      "sac_status": ""
    },
    {
      "concept": "commands",
      "concern": "sac_silent_on_unportable",
      "name": "THROW",
      "notes": "",
      "pragmatic_tier": "iris-only",
      "sac_section": "",
      "sac_status": ""
    },
    {
      "concept": "commands",
      "concern": "sac_silent_on_unportable",
      "name": "TRESTART",
      "notes": "",
      "pragmatic_tier": "ydb-only",
      "sac_section": "",
      "sac_status": ""
    },
    {
      "concept": "commands",
      "concern": "sac_silent_on_portable",
      "name": "TROLLBACK",
      "notes": "",
      "pragmatic_tier": "core",
      "sac_section": "",
      "sac_status": ""
    },
    {
      "concept": "commands",
      "concern": "sac_silent_on_unportable",
      "name": "TRY",
      "notes": "",
      "pragmatic_tier": "iris-only",
      "sac_section": "",
      "sac_status": ""
    },
    {
      "concept": "commands",
      "concern": "sac_silent_on_portable",
      "name": "TSTART",
      "notes": "",
      "pragmatic_tier": "core",
      "sac_section": "",
      "sac_status": ""
    },
    {
      "concept": "commands",
      "concern": "sac_silent_on_portable",
      "name": "USE",
      "notes": "",
      "pragmatic_tier": "core",
      "sac_section": "",
      "sac_status": ""
    },
    {
      "concept": "commands",
      "concern": "sac_says_avoid_but_portable",
      "name": "VIEW",